{"schema":"ces.issue_eligibility_review.v1","method":"REVIEW_LOCAL_ISSUE_PROPOSAL_ELIGIBILITY","reviewer_key_id":"synthetic-unsigned","evaluation_sha256":"0000000000000000000000000000000000000000000000000000000000000000","decision":"ACKNOWLEDGE_FOR_LOCAL_PROPOSAL_ONLY","acknowledges_selected_issues_not_inventory":true,"acknowledges_duplicate_absence_unproven":true,"acknowledges_source_and_signer_authority_unverified":true,"issued_at_utc":"2026-10-24T00:00:00Z","expires_at_utc":"2026-10-24T00:01:00Z","signature_base64":"AAAAAAAAAAAAAAAAAAAAAAAAAAAAAAAAAAAAAAAAAAAAAAAAAAAAAAAAAAAAAAAAAAAAAAAAAAAAAAAAAAAAAA=="}
